id,title,description,difficulty,duration_minutes,tags,format,url
109,Deep Dive into Stochastic Gradient Descent Optimization for Machine Learning Models,"This advanced-level video tutorial provides a comprehensive guide to implementing and fine-thinning the Stochastic Gradient Descent algorithm in various machine learning scenarios. It delves into hyperparameter tuning, convergence criteria, and bias-variance tradeoff intricacies for optimizing deep neural networks.",Advanced,45,"[""architecture"", ""deployment""]",video,https://example.com/tutorials/machine-learning/109
110,Docker for Beginners - Introduction to Containerization with Docker,"This beginner-level video tutorial introduces the concept of containerization using Docker, a popular tool that simplifies application deployment and scaling. Learn how containers encapsulate an app' endless process in isolation from other processes on Linux systems.",Beginner,15,"[""ai"", ""ml"", ""architecture"", ""deployment""]",video,https://example.com/tutorials/docker/110
111,Mastering Kubernetes with Intermediate Practices for Container Orchestration,"This intermediate-level blog post is designed to guide users through practical and applied aspects of using Kubernetes. It includes hands-on examples, troubleshooting tips, best practices for scaling applications in a clustered environment, and real-world use cases that demonstrate how Kubernetes can be effectively utilized in production scenarios.",Intermediate,120,"[""ai"", ""kubernetes"", ""deployment"", ""docker""]",blog,https://example.com/tutorials/kubernetes/111
112,Intermediate Applied Machine Learning Practices for Data Scientists,"Dive into the practical applications of machine learning with this intermediate-level video course, where you'll learn to preprocess data, build predictive models using scikit-learn and TensorFlow, evaluate their performance, and deploy them in production environments. This comprehensive guide will empower your skills beyond theory.",Intermediate,15,"[""ml"", ""kubernetes"", ""architecture""]",video,https://example.com/tutorials/machine-learning/112
113,Mastering Kubernetes Workloads for High Availability Environments,"This article delves into the advanced concepts of setting up and managing high availability (HA) workloads in a Kubernetes environment. Topics covered include strategic HA pod distribution, consistent hashing with persistent storage solutions, multi-zone networking for reliable service discovery, sophisticated health checks to trigger failovers smoothly, integration testing across environments, automation of release pipelines, and security best practices using RBAC in complex cluster configurations.",Advanced,90,"[""ai"", ""architecture""]",article,https://example.com/tutorials/kubernetes/113
114,Kubernetes Essentials for Beginners - Introduction to Container Orchestration,"Dive into the world of Kubernetes with this beginner-friendly blog post, where we demystify container orchestration and explain how Kubernetes can manage your applications. No prior experience required – just curiosity about running modern software!",Beginner,90,"[""ai"", ""architecture""]",blog,https://example.com/tutorials/kubernetes/114
115,Kubernetes Essentials for Enterprise Use Cases – An Intermediate Guide,"Dive into the practical deployment and management aspects of Kubernetes, tailored specifically to enterprises. This guide covers intermediate concepts like rolling updates, service discovery, secret management, networking configurations, security practices, and monitoring tools with ample examples.",Intermediate,15,"[""kubernetes"", ""architecture"", ""deployment"", ""ml""]",article,https://example.com/tutorials/kubernetes/115
116,Mastering Kubernetes at an Expert Level: Advanced Techniques for Production Environments,"Dive into the complexities of deploying, scaling, and managing applications in production with Kubernetes. This advanced-level blog post is designed to equip experienced IT professionals with cutting-edge practices and troubleshooting strategies essential for maintaining robust systems.",Advanced,30,"[""architecture"", ""ml"", ""ai"", ""docker""]",blog,https://example.com/tutorials/kubernetes/116
117,Docker for Beginners - An Introduction to Containerization Technology,"This beginner-level video tutorial introduces the concept of Docker and containerization technology, explaining how containers work, why they're beneficial in software development, and providing a step-bythough walkthrough on setting up your first Docker environment.",Beginner,120,"[""architecture"", ""kubernetes"", ""ai""]",video,https://example.com/tutorials/docker/117
118,Docker Explained: Intermediate Techniques for Container Management,"This article guides you through the intermediate aspects of Docker, including advanced container management strategies such as deploying multi-container applications using docker-compose and orchestrating containers at scale with Kubernetes. It assumes familiarity with basic Docker concepts like images, containers, and volumes.",Intermediate,60,"[""python"", ""ai"", ""architecture"", ""ml""]",article,https://example.com/tutorials/docker/118
119,Interpreting Machine Learning Model Performance Metrics at Intermediate Level,"This intermediate-level article will guide readers through various performance metrics commonly used to evaluate machine learning models, such as accuracy, precision, recall, and F1 score. It explains the significance of each metric in different scenarios by using realistic examples from supervised and unsupervised learning tasks.",Intermediate,60,"[""ai"", ""docker"", ""kubernetes""]",article,https://example.com/tutorials/machine-learning/119
120,Interpreting Confusion Matrices for Machine Learning Proficiency Levels,"This blog post explores the nuances of confusion matrices, their significance in evaluating model performance across different levels of machine learning expertise. Designed to enhance intermediate practitioners' understanding and ability to apply this critical analysis tool effectively.",Intermediate,60,"[""ml"", ""deployment""]",blog,https://example.com/tutorials/machine-learning/120
121,Beginner's Guide to Understanding Kubernetes for DevOps Success,"This beginner-friendly blog post introduces the fundamental concepts of Kubernetes, a powerful open-source system for managing containerized applications. Learn how it automates deployment, scaling, and operations of application containers across clusters of hosts to improve resource utilization, reduce complexity, and manage infrastructure.",Beginner,90,"[""deployment"", ""architecture"", ""ml""]",blog,https://example.com/tutorials/kubernetes/121
122,Kubernetes for Beginners - Introduction to Container Orchestration,"Dive into Kubernetes, the container orchestration system that automates deployment, scaling, and management of applications. This beginner-friendly blog post will walk you through setting up a simple Kubernetes cluster using Minikube for local testing.",Beginner,15,"[""ml"", ""docker"", ""python"", ""kubernetes""]",blog,https://example.com/tutorials/kubernetes/122
123,Mastering Docker for Production Environments - A Deep Dive into Container Orchestration and Security Best Practices,"This advanced-level tutorial provides an in-depth exploration of Docker as a containerization technology, focusing on orchestrating complex deployments with tools like Kubernetes while emphasizing security best practices for production environments. By the end of this video series, viewers will have acquired sophisticated skills to efficiently manage and secure their applications at scale.",Advanced,30,"[""architecture"", ""kubernetes""]",video,https://example.com/tutorials/docker/123
124,Intermediate Docker Mastery - Practical Production Use Cases,"This video course demystifies the advanced aspects of Docker, guiding learners through practical production scenarios to master container orchestration with Kubernetes. Dive deep into complex workflows and gain confidence in deploying robust applications.",Intermediate,90,"[""architecture"", ""docker"", ""python"", ""kubernetes""]",video,https://example.com/tutorials/docker/124
125,Mastering Kubernetes Pod Disruption Budgets at Advanced Levels,"This blog post delves into the complex world of ensuring high availability in containerized environments using advanced disruption budgets. Learn about setting strategic thresholds, managing grace periods during scaling events, and automating resiliency policies with sophisticated Kubernetes tools.",Advanced,15,"[""docker"", ""ml"", ""ai""]",blog,https://example.com/tutorials/kubernetes/125
126,Intermediate Kubernetes Essentials - A Hands-On Guide for Operators and Technical Professionals,"Dive into the core capabilities of Kubernetes tailored to intermediate users. This blog post explores practical scenarios that involve deploying applications, scaling them efficiently, managing stateful workloads with persistent storage, handling rollouts, debugging issues using advanced tools like `kubectl` and `Kleiner`, as well as configuring network policies for secure communication within microservices architectures.",Intermediate,120,"[""deployment"", ""ml""]",blog,https://example.com/tutorials/kubernetes/126
127,Kubernetes Deployment Strategies for Beginners,"In our latest blog post, we explore the basic deployment strategies in Kubernetes to help beginners understand how microservices can be orchestrated effectively. This guide walks you through setting up deployments and rolling updates with minimal complexity.",Intermediate,15,"[""python"", ""docker"", ""ai""]",blog,https://example.com/tutorials/kubernetes/127
128,Docker Essentials for Beginners: Introduction to Containerization,"This article is designed to introduce the fundamental concepts of Docker, a tool that simplifies and accelerates application development by utilizing containers. We'll begin with setting up an environment on your local machine using Docker Desktop, create our first container from scratch in just five steps, understand how images work within this ecosystem, learn about managing ports for communication between the host system and running applications inside a container, as well as explore basic security practices essential to maintaining safe deployment scenarios.",Beginner,90,"[""deployment"", ""docker"", ""kubernetes"", ""ml""]",article,https://example.com/tutorials/docker/128
129,Intermediate Kubernetes Troubleshooting Guide for Containers on AWS EKS,"This blog post is tailored to individuals with some familiarity with container orchestration and looking to tackle common issues within an Amazon Elastic Kubernetes Service (EKS) environment. We will cover topics such as troubleshooting node selection, pod scheduling conflicts, network policies, load balancing strategies, secret management, and handling persistent storage in a multi-node cluster.",Intermediate,30,"[""architecture"", ""deployment"", ""docker""]",blog,https://example.com/tutorials/kubernetes/129
130,Interpreting Intermediate Machine Learning Algorithms for Business Analytics,"This article provides readers with a practical and applied understanding of intermediate-level machine learning algorithms. It bridges the gap between theory and real business applications, explaining how these models can drive data-driven decisions within an enterprise context.",Intermediate,90,"[""ai"", ""ml""]",article,https://example.com/tutorials/machine-learning/130
131,Advanced Techniques for Scalable Machine Learning Pipelines on Cloud Platforms,"This article delves into the intricacurate engineering required to design, implement and scale machine learning (ML) pipelines using cloud services. It covers data ingestion, model training with distributed systems, deployment strategies like A/B testing, monitoring ML models for performance drift, and optimizing resource allocation in a pay-per-use environment.",Advanced,90,"[""docker"", ""python""]",article,https://example.com/tutorials/machine-learning/131
132,Machine Learning Algorithms for Real Estate Pricing Predictions - An Intermediate Guide,"This article delves into practical applications of machine learning techniques specifically tailored to predict real estate prices. It provides readers with an intermediate-level understanding, covering data preprocessing steps such as normalization and outlier detection, the selection of appropriate regression algorithms like Linear Regression or Random Forests for prediction accuracy, and hands-on tips on implementing models using Python' endorsing practical skills alongside theoretical knowledge.",Intermediate,120,"[""architecture"", ""python""]",article,https://example.com/tutorials/machine-learning/132
133,Introduction to Docker for Beginners,"Dive into the world of containerization with our beginner-friendly guide that unravels what Docker is, how it works and why developers use it. This blog post will introduce you to basic concepts like images, containers, volumes, and networks in a simple yet engaging way.",Beginner,90,"[""python"", ""ml"", ""architecture""]",blog,https://example.com/tutorials/docker/133
134,Docker for Beginners: A Step-by-Step Guide to Containerization and Deployment,"Welcome to the world of Docker, where you'll learn container technology from scratch! This beginner blog post will take you through basic concepts like containers, images, and how to run a simple web application in one easy step.",Beginner,60,"[""docker"", ""deployment"", ""python"", ""ml""]",blog,https://example.com/tutorials/docker/134
135,Advanced Techniques for Scalable Machine Learning Pipelines with Production Code Examples,"Dive into the intricain details of constructing scalable, production-ready machine learning pipelines. This blog post explores complex models and algorithms at an advanced level while providing hands-on code examples to illustrate these concepts.",Advanced,90,"[""python"", ""deployment""]",blog,https://example.com/tutorials/machine-learning/135
136,Advanced Kubernetes Techniques for High Availability and Scalability,"Dive into the complexities of designing robust, high-availability systems with advanced Kubernetes configurations. This professional video tutorial explores production patterns such as Rolling Updates, Multi-Zone Deployments, Cluster Autoscaler, Pod Disruption Budgets, and custom resource definitions for orchestrating stateful applications.",Advanced,45,"[""deployment"", ""python"", ""architecture"", ""ml""]",video,https://example.com/tutorials/kubernetes/136
137,Docker Essentials for Intermediate Developers - Part Two,"In our second installment, 'Docker Essentials for Intermediate Developers,' we delve deeper into Docker best practices and advanced container management techniques. Learn to orchestrate multi-container setups using Docker Compose, understand volume inheritance with linked containers, optimize your images' security settings, leverage the power of swarming capabilities in Docker Swarm mode, manage stateful applications effectively within this declarative approach.",Intermediate,45,"[""architecture"", ""kubernetes""]",video,https://example.com/tutorials/docker/137
138,Kubernetes for Beginners: An Introduction to Container Orchestration,"This blog post serves as a fundamental guide into Kubernetes, the open-source platform used for automating deployment, scaling, and management of containerized applications. We'll start from setting up your local development environment to deploying containers in production on cloud platforms like AWS EKS or GKE.",Beginner,15,"[""ml"", ""kubernetes""]",blog,https://example.com/tutorials/kubernetes/138
139,Understanding Kubernetes for Beginners: An Introduction to Container Orchestration,"This article guides beginners through the foundational concepts of Kubernetes, a powerful container orchestration system. We'll cover what containers are and why they’re used, before diving into how Kubernetes works at its core—its architecture, components, and deployment strategies like rolling updates.",Beginner,120,"[""python"", ""architecture"", ""deployment"", ""docker""]",article,https://example.com/tutorials/kubernetes/139
140,Docker's Role in Modern Software Deployment - An Intermediate Guide,"This article delves into how Docker has revolutionized software deployment, providing a clear understanding of its impact on continuous integration and delivery pipelines. With practical examples from industry use-cases, readers will grasp the significance of containerization technology for streamlined development workflows.",Intermediate,90,"[""python"", ""ai""]",article,https://example.com/tutorials/docker/140
141,Navigating Docker Containers for Intermediate DevOps Enthusiasts,"This blog post delves into the practical usage of Docker containers in a development workflow. It covers creating, managing, and orchestrating multiple containers to streamline microservices architecture while emphasizing security best practices.",Intermediate,45,"[""python"", ""ml"", ""deployment""]",blog,https://example.com/tutorials/docker/141
142,Interpreting Machine Learning Models for Intermediate Developers,"This article explores the practical application of machine learning models, focusing on interpretation and evaluation techniques. It guides intermediate developers through understanding model predictions, feature importance, decision boundaries, and performance metrics essential for improving their ML projects.",Intermediate,15,"[""python"", ""ai"", ""architecture""]",article,https://example.com/tutorials/machine-learning/142
143,Advanced Ensemble Learning for Predictive Analytics with Python,"This article delves into the sophisticated techniques of ensemble learning in machine learning, exploring how to construct and fine-tune diverse models such as bagging, boosting, and stacking. It examines practical production scenarios where these methods enhance predictive accuracy while also discussing Python's role through libraries like scikit-learn for realizing complex ensembles effectively.",Advanced,120,"[""docker"", ""python"", ""deployment"", ""ml""]",article,https://example.com/tutorials/machine-learning/143
144,Mastering Production-Level Machine Learning Pipelines with Python and Scikit-Learn,"This advanced blog post delves into the complexities of building, tuning, and deploying robust machine learning pipelines using industry-standard tools like Python and Scikit-Learn. It provides insights on preprocessing data, selecting models for production environments, hyperparameter optimization techniques, performance evaluation metrics specific to real-world applications, and best practices for deployment.",Advanced,90,"[""ai"", ""kubernetes"", ""ml"", ""docker""]",blog,https://example.com/tutorials/machine-learning/144
145,Advanced Techniques for Optimizing Machine Learning Pipelines,"This article delves into the complex and intricate world of machine learning pipelines, discussing strategies to enhance their efficiency and performance at a production-level scale. Advanced topics such as distributed computing frameworks (Apache Spark), parallel processing techniques, and real-time data stream handling are explored.",Advanced,45,"[""python"", ""ai""]",article,https://example.com/tutorials/machine-learning/145
146,Introduction to Machine Learning for Beginners - Fundamentals Simplified,"Dive into the world of machine learning with this easy-toinspired video tutorial, where beginners will grasp fundamental concepts in a straightforward and enjoyable manner. You'll learn about data types, algorithms, neural networks, and how they can impact your career.",Beginner,120,"[""deployment"", ""ml"", ""python""]",video,https://example.com/tutorials/machine-learning/146
147,Understanding Kubernetes Ingress Controllers for HTTP Traffic Management,"This article delves into the concept of ingress controllers within Kubernetes, explaining how they enable more efficient routing and management of external HTTP traffic to cluster services. We'll explore different types of ingress resources, such as NodePort, LoadBalancer, and Istio-mTLS Ingress Gateways that provide varying levels of complexity in handling requests.",Intermediate,60,"[""ai"", ""docker"", ""architecture"", ""ml""]",article,https://example.com/tutorials/kubernetes/147
148,Mastering Kubernetes Operations for Production Environments,"Dive into the advanced aspects of managing a robust, scalable container orchestration with this comprehensive guide on leveraging and optimizing Kubernetes in real-world scenarios. Explore complex networking solutions, persistent storage options, custom resource definitions, horizontal pod autoscaling, service mesh integration, multi-cluster management strategies, security best practices, monitoring tools deployment, troubleshooting techniques, disaster recovery planning, cost optimization methods and the transition to serverless architectures within Kubernetes. This advanced article is designed for seasoned practitioners looking to refine their skills in handling large-scale deployments with efficiency.",Advanced,45,"[""architecture"", ""docker"", ""kubernetes"", ""ml""]",article,https://example.com/tutorials/kubernetes/148
149,Interpreting Feature Importance for Machine Learning Models,"This article dives into the significance of feature importance in machine learning, providing insights on how to interpret and leverage this knowledge. Readers will learn practical methods like permutation importance and SHAP values that aid decision-making processes.",Intermediate,60,"[""deployment"", ""ml"", ""architecture""]",article,https://example.com/tutorials/machine-learning/149
150,Mastering Kubernetes at Production Scale - Advanced Guide with Practical Examples and Tips,"This professional-level video tutorial delves deep into advanced concepts of running applications in production using Kubernetes. Learn from industry experts about setting up complex deployments, managing stateful workloads, fine-tuning performance at scale, handling security concerns, and more.",Advanced,90,"[""architecture"", ""ml"", ""python""]",video,https://example.com/tutorials/kubernetes/150
151,Docker Essentials for DevOps Engineers - An Intermediate Guide to Containerization,"This video tutorial offers an intermediate-level exploration of Docker, diving into practical use cases and tools essential for modern software development. It's tailored specifically for developers aiming to optimize their workflow through containerization.",Intermediate,30,"[""deployment"", ""docker""]",video,https://example.com/tutorials/docker/151
152,Beginner's Guide to Introduction of Machine Learning Concepts,"Welcome, aspiring learners! This blog post is designed as a primer on the fundamental concepts and terminology in machine learning. You will be guided through an easy-tointrinsic understanding that lays down your groundwork for more complex studies.",Beginner,30,"[""architecture"", ""ai"", ""ml""]",blog,https://example.com/tutorials/machine-learning/152
153,Advanced Techniques for Scalable Machine Learning Pipelines,"Dive deep into the complexities of building scalable machine learning systems with this comprehensive guide. Learn to architect, develop, and optimize production-level pipelines using cutting-curent ML frameworks.",Advanced,60,"[""python"", ""architecture""]",blog,https://example.com/tutorials/machine-learning/153
154,Understanding Machine Learning for Beginners – An Introduction to Building Predictive Models,"This beginner-level blog post offers a straightforward overview of machine learning, explaining fundamental concepts such as supervised and unsupervised learning. It guides readers through the process of building their first predictive models using simple language and real-world examples.",Beginner,15,"[""python"", ""ai""]",blog,https://example.com/tutorials/machine-learning/154
155,Kubernetes for Beginners - Introduction to Container Orchestration,"This beginner-level video tutorial introduces Kubernetes, a powerful container orchestration system that simplifies the deployment and management of applications. Starting from its core concepts like Pods, Deployments, and Services, learners will understand how containers work together to create robust application architectures.",Beginner,15,"[""ml"", ""architecture"", ""python""]",video,https://example.com/tutorials/kubernetes/155
156,Getting Started with Kubernetes for DevOps Beginners,"Welcome to the world of container orchestration! This beginner's blog post will demystify Kubernetes, covering its basic concepts and showing you how it can streamline your development workflow. Whether you are new to containers or just beginning with Kubernetes, this guide is designed to give a firm foundation.",Beginner,60,"[""ai"", ""kubernetes"", ""architecture""]",blog,https://example.com/tutorials/kubernetes/156
157,Interpreting Machine Learning Models for Better Decision Making,"This intermediate-level blog post will guide you through understanding the mechanics behind machine learning models and how to interpret their results accurately. Learn about feature importance, model evaluation metrics like precision, recall, F1 score, as well as techniques such as cross-validation for robust analysis.",Intermediate,30,"[""ml"", ""deployment""]",blog,https://example.com/tutorials/machine-learning/157
158,Mastering Docker for Intermediate Developers: Practical Guide to Containerization,"Dive into the practical aspects of using Docker, designed specifically for intermediate developers looking to apply container technology in real-world scenarios. This blog post will cover essential concepts such as images, containers, and orchestration with Kubernetes while providing hands-on examples.",Intermediate,120,"[""ml"", ""docker""]",blog,https://example.com/tutorials/docker/158
