id,title,description,difficulty,duration_minutes,tags,format,url
56,Advanced Production Techniques for Machine Learning Systems,"This advanced-level video tutorial dives deep into the technical aspects of producing robust machine learning systems. It covers topics such as model selection, hyperparameter tuning with grid search and randomized search, ensemble methods like stacking and boosting, feature engineering strategies for complex datasets, optimization techniques to enhance prediction performance, handling big data at scale using distributed computing frameworks, ensuring reproducibries in machine learning experiments through controlled experimentation design. The video also provides insights into the latest advancements from cutting-edge research papers.",Advanced,30,"[""docker"", ""python""]",video,https://example.com/tutorials/machine-learning/56
57,Kubernetes for Beginners - An Introduction to Container Orchestration,"This blog post is designed to introduce the basics of Kubernetes, a powerful system that orchestrates containerized applications. It provides practical examples and guidance on setting up your first Pods (the smallest deployable units in K8s), Nodes (where those Pods run), and Deployments (groups of Pods). This foundational knowledge will help you understand the role of each component within a cluster.",Beginner,60,"[""ai"", ""docker""]",blog,https://example.com/tutorials/kubernetes/57
58,Intro to Machine Learning for Beginners - Understanding the Basics,"This beginner-level video guide introduces fundamental concepts of machine learning, covering topics like data sets and algorithms with practical examples. Designed for novices looking to understand how machines learn from experience.",Beginner,60,"[""architecture"", ""python"", ""ml"", ""kubernetes""]",video,https://example.com/tutorials/machine-learning/58
59,Advanced Machine Learning Techniques for Predictive Analytics,"Dive deep into the world of advanced machine learning algorithms, exploring cutting-curves and techniques that are essential for sophisticated predictive analytics. This blog post will guide you through various complex concepts like ensemble methods, neural networks architecture optimization, Bayesian approaches to uncertainty quantification in predictions, as well as practical considerations when deploying models into production environments.",Advanced,30,"[""ml"", ""kubernetes"", ""deployment"", ""architecture""]",blog,https://example.com/tutorials/machine-learning/59
60,Navigating Networking in Kubernetes at Intermediate Level,"This blog post delves into the nuances of networking within a Kubernetes environment, covering topics like service discovery and DNS resolution. Targeted towards intermediate users with prior basic knowledge, it provides actionable strategies for optimizing communication between pods.",Intermediate,120,"[""python"", ""ai""]",blog,https://example.com/tutorials/kubernetes/60
61,Mastering Docker Containers for Microservices Architecture at an Advanced Level,"In this advanced-level tutorial, you'll delve deep into the intricaries of managing complex microservices using Docker. We explore container orchestration with Kubernetes and learn how to optimize resource allocation in a production environment.",Advanced,90,"[""architecture"", ""docker"", ""deployment""]",video,https://example.com/tutorials/docker/61
62,Kubernetes for Beginners - Getting Started with Container Orchestration,"Embark on your journey into the world of Kubernetes by understanding its core principles and setting up a simple cluster. This beginner-level guide walks you through installing, configuring, and deploying containers using Pods for hands-on learning.",Beginner,45,"[""ml"", ""ai"", ""kubernetes""]",blog,https://example.com/tutorials/kubernetes/62
63,Kubernetes for Beginners - Introduction to Container Orchestration,"This blog post offers a foundational introduction to Kubernetes, explaining the basics of container orchestration and how it simplifies deploying applications. Ideal for newcomers looking to get their first steps into using Kubernetes in practice.",Beginner,45,"[""architecture"", ""ai"", ""ml""]",blog,https://example.com/tutorials/kubernetes/63
64,Docker Demystified: A Beginner's Guide to Containerization,"Embark on a journey into the world of Docker, where you will learn how containers simplify application deployment. This beginner-friendly blog post uncovers the fundamentals behind container technology and guides readers through installing Docker with easy steps.",Beginner,45,"[""architecture"", ""deployment""]",blog,https://example.com/tutorials/docker/64
65,Docker for DevOps Engineers - Container Orchestration Essentials,"This intermediate-level blog post explores the essential concepts of Docker container orchestration, providing practical insights and hands-on examples to elevate your development workflow. Learn how to effectively manage containers across multiple hosts with tools like Kubernetes or Docker Swarm.",Intermediate,60,"[""ml"", ""docker""]",blog,https://example.com/tutorials/docker/65
66,Kubernetes Essentials for Beginners – Understanding the Basics of Container Orchestration,"Dive into Kubernetes and unravel its core concepts, from pods to services. This beginner-level blog post aims to demystify container orchestration in an easy-to-understand format suitable for those just starting out with the technology.",Beginner,30,"[""deployment"", ""ai"", ""kubernetes"", ""ml""]",blog,https://example.com/tutorials/kubernetes/66
67,Introduction to Kubernetes for Beginners,"This article serves as a foundational guide designed to introduce the basics of container orchestration with Kubernetes. It walks beginners through setting up their first cluster, deploying applications in containers, and monitoring resource usage within Kubernetes.",Beginner,60,"[""docker"", ""python"", ""ml""]",article,https://example.com/tutorials/kubernetes/67
68,Advanced Production Techniques for Machine Learning Models with TensorFlow and PyTorch,"In this advanced-level video course, learners will delve into the complexities of implementing machine learning models using state-ofmediate libraries like TensorFlow and PyTorch. The content includes setting up distributed training systems for scalability, fine-tuning hyperparameters for optimal performance, and ensuring reproducibility in research settings.",Advanced,30,"[""ai"", ""python"", ""architecture"", ""deployment""]",video,https://example.com/tutorials/machine-learning/68
69,Intermediate Kubernetes: Optimizing Deployments for Production Use Cases,"This intermediate-level article takes learners through the practical application of deploying, managing, and optimizing applications using Kubernetes in a production environment. Emphasis is placed on understanding resource constraints, scaling strategies, networking complexities within clusters, health monitoring practices, and common pitfalls.",Intermediate,120,"[""docker"", ""kubernetes"", ""architecture""]",article,https://example.com/tutorials/kubernetes/69
70,The Essentials of Machine Learning for Beginners,"Dive into the world of machine learning with our beginner-friendly guide. Explore fundamental concepts, terminologies and algorithms in simple language to build a solid foundation before moving on to more complex topics.",Beginner,15,"[""python"", ""architecture""]",blog,https://example.com/tutorials/machine-learning/70
71,Docker for Beginners - An Introduction to Containerization Technology,"Welcome to the world of Docker, where this blog post serves as a simple yet comprehensive guide aimed at beginners. We'll start by explaining what containers are and why they matter in modern software development before diving into how you can install Docker on your system.",Beginner,30,"[""python"", ""deployment"", ""architecture""]",blog,https://example.com/tutorials/docker/71
72,Kubernetes Basics for Beginners - Intro to Container Orchestration,"This video tutorial is designed as a gentle introduction into Kubernetes. Learn the fundamental concepts of container orchestration, including pods, services, and deployments with simple examples that lay down the groundwork for anyone starting their journey in cloud-native technologies.",Beginner,60,"[""ml"", ""ai"", ""docker""]",video,https://example.com/tutorials/kubernetes/72
73,Docker Intermediate Guide to Building Efficient Microservices,"This blog post delves into the practical aspects of Docker, focusing on how it facilitates microservice architecture and improves application efficiency. Ideal for intermediate learners with a foundational understanding of containerization.",Intermediate,15,"[""ml"", ""architecture"", ""docker""]",blog,https://example.com/tutorials/docker/73
74,Mastering Kubernetes with Real-World Applications: An Intermediate Guide for Developers and Engineers,"Dive into the practical aspects of deploying, managing, and scaling applications using Kubernetes. This intermediate guide covers essential skills needed to handle container orchestration effectively while drawing on real-world examples from industry experts.",Intermediate,90,"[""deployment"", ""kubernetes""]",blog,https://example.com/tutorials/kubernetes/74
75,Advanced Machine Learning Production Pipeline Development with Python,"This advanced-level video tutorial delves into creating robust machine learning production pipelines using popular libraries like scikit-learn and TensorFlow in Python. Experts will learn to automate data preprocessing, model training, evaluation, hyperparameter tuning, deployment strategies including cloud services such as AWS Sagemaker or GCP AI Platform, monitoring solutions for real-time insights into their models' performance.",Advanced,15,"[""ai"", ""deployment""]",video,https://example.com/tutorials/machine-learning/75
76,Advanced Machine Learning Architectures for Production Systems,"This article delves into the sophisticated realm of machine learning, where models are not just designed but also tuned and deployed at a production level. It covers state-of-the-art techniques such as ensemble methods, neural networks with advanced topologies like convolutional layers for image tasks, recurrent units for sequence prediction, and discusses strategies to handle data scalability challenges in modern big data environments.",Advanced,120,"[""kubernetes"", ""python""]",article,https://example.com/tutorials/machine-learning/76
77,"Intermediate Kubernetes - Deploying, Scaling and Managing Pods","This video course takes a practical look at intermediate-level Kubernetes topics. You'll learn to deploy pods using YAML manifests, scale your applications with Horizontal Pod Autoscaler (HPA), monitor performance through metrics like CPU utilization and readiness probes, as well as manage workloads efficiently.",Intermediate,60,"[""docker"", ""kubernetes"", ""deployment"", ""ai""]",video,https://example.com/tutorials/kubernetes/77
78,Kubernetes Workflow Optimization for Intermediate Users,"In the world of container orchestration, Kubernetes stands out as a powerful tool. This intermediate-level guide focuses on optimizing workflows within Kubernetes to improve efficiency and scalability in production environments.",Intermediate,15,"[""docker"", ""ml"", ""python"", ""ai""]",article,https://example.com/tutorials/kubernetes/78
79,Mastering Kubernetes for Production Systems - Advanced Deployment Techniques and Optimization,"Dive deep into the heart of Kubernetes with this advanced tutorial designed to elevate your deployment strategies. Learn about complex scaling methods, resource management policies, networking considerations in production-grade environments, as well as troubleshooting tips for maintaining a resilient and efficient system.",Advanced,60,"[""ai"", ""docker""]",video,https://example.com/tutorials/kubernetes/79
80,Machine Learning Basics for Beginners: A Foundation Course,"This article serves as an introductory guide to the foundational concepts of machine learning, designed specifically for beginners. It explains key terms and algorithms in a simplified manner without requiring prior knowledge or experience.",Beginner,90,"[""docker"", ""ml"", ""ai""]",article,https://example.com/tutorials/machine-learning/80
81,Beginner's Guide to Machine Learning Basics,"This blog post demystifies the fundamental concepts of machine learning, starting from definitions and key terminology. It aims to build confidence for beginners by providing clear explanations with simple analogies that are essential stepping stones towards understanding more complex algorithms.",Beginner,90,"[""python"", ""architecture""]",blog,https://example.com/tutorials/machine-learning/81
82,Beginner's Guide to Kubernetes for DevOps Engineers,"This video provides a foundational understanding of Kubernetes, covering its core concepts and benefits in the context of modern software development. Designed specifically for beginners with no prior knowledge required.",Beginner,30,"[""kubernetes"", ""docker"", ""deployment"", ""architecture""]",video,https://example.com/tutorials/kubernetes/82
83,Beginner's Guide to Machine Learning Essentials,"This blog post is designed for beginners looking to understand the basics of machine learning. We will explore fundamental concepts, simple algorithms like linear regression and decision trees, and real-world applications where these techniques are applied.",Beginner,60,"[""python"", ""deployment"", ""kubernetes"", ""architecture""]",blog,https://example.com/tutorials/machine-learning/83
84,Machine Learning for Beginners - An Introduction to Predictive Modeling,"This video is perfect for beginners interested in understanding the fundamental concepts of machine learning, specifically predictive modeling. The content demystifies complex theories and presents them through simple language and relatable examples.",Beginner,90,"[""docker"", ""ai"", ""ml"", ""python""]",video,https://example.com/tutorials/machine-learning/84
85,Kubernetes Essentials for DevOps Engineers - Intermediate Guide,"This article serves as a comprehensive guide to Kubernetes from an intermediate perspective. It explores practical scenarios, real-world applications, and the common challenges faced by developers in orchestrating containerized workloads using Kubernetes.",Intermediate,30,"[""deployment"", ""python"", ""docker""]",article,https://example.com/tutorials/kubernetes/85
86,Advanced Kubernetes Best Practices for Production Environments,"Dive deep into the complexities of deploying robust, scalable applications using advanced Kubernetes features. This blog post examines best practices that are critical in a production-level setup to ensure high availability, resilience, and efficient resource utilization.",Advanced,30,"[""ml"", ""python""]",blog,https://example.com/tutorials/kubernetes/86
87,Beginner's Guide to Understanding Kubernetes for Cloud Native Applications,"Dive into the world of container orchestration with this beginner-friendly article. Learn what containers are, why you might want to use them in your applications, and how Kubernetes helps manage these resources effectively.",Beginner,90,"[""deployment"", ""ai"", ""architecture"", ""kubernetes""]",article,https://example.com/tutorials/kubernetes/87
88,Intermediate Docker Use Cases for Efficient Microservice Deployment,"This blog post explores practical and applied scenarios where Docker is used to deploy microservices efficiently. It addresses common challenges, such as managing multiple containerized services with a single host system while maintaining isolation between containers.",Intermediate,60,"[""kubernetes"", ""docker"", ""deployment"", ""python""]",blog,https://example.com/tutorials/docker/88
89,Docker for Beginners - A First Step into Containerization,"In the blog post 'Docker for Beginners,' learners will grasp fundamental concepts of Docker, such as containers and images. This beginner-level guide offers step-bythorough instructions on setting up a simple container from scratch using just basic commands.",Beginner,90,"[""ai"", ""ml"", ""architecture""]",blog,https://example.com/tutorials/docker/89
90,Understanding Kubernetes for Beginners - An Introduction to Container Orchestration,"Dive into the world of container orchestration with this beginner's guide on Kubernetes. Learn about its purpose, components and why it’s essential in modern software development. This blog post will simplify complex concepts for a seamless understanding.",Beginner,45,"[""deployment"", ""architecture""]",blog,https://example.com/tutorials/kubernetes/90
91,Intro to Machine Learning for Beginners - Understanding the Basics,"This video guide is crafted by a certified technical content creator. It serves as an introductory course on machine learning, focusing on fundamental concepts and simple applications suitable for beginners in technology.",Beginner,60,"[""deployment"", ""docker"", ""ai"", ""kubernetes""]",video,https://example.com/tutorials/machine-learning/91
92,Intermediate Machine Learning with Python - Practical Application Examples,"This intermediate-level article delves into the application of machine learning algorithms using Python. It offers a hands-on approach, guiding learners through various practical examples and real-world use cases to solidify their understanding.",Intermediate,15,"[""deployment"", ""ml"", ""python"", ""kubernetes""]",article,https://example.com/tutorials/machine-learning/92
93,Mastering Docker Swarm for Scalable Container Orchestration,"This article delves into advanced techniques of using Docker's native orchestrator, 'Swarm', to manage containerized applications at scale. It covers cluster deployment, service discovery, load balancing, and failover strategies with an emphasis on ensnerving robustness in production environments.",Advanced,30,"[""ai"", ""python"", ""kubernetes"", ""ml""]",article,https://example.com/tutorials/docker/93
94,Kubernetes for Beginners: A Step-by-Step Guide to Container Orchestration,"This article introduces Kubernetes, a powerful container orchestration system that automates the deployment, scaling, and management of applications in containers. Learn how this tool empowers developers by simplifying complex tasks associated with managing microservices.",Beginner,60,"[""ai"", ""ml"", ""deployment""]",article,https://example.com/tutorials/kubernetes/94
95,Docker for Beginners: An Introductner's Guide to Containerization,"Embark on your container journey with Docker, the powerful platform that packages applications and services. This beginner-friendly blog post will guide you through understanding containers and how they work within a microservices architecture while providing simple hands-on examples for setting up your first Docker environment.",Beginner,30,"[""kubernetes"", ""architecture"", ""ml"", ""ai""]",blog,https://example.com/tutorials/docker/95
96,Navigating Kubernetes Complexity with Intermediate Best Practices,"This blog post delves into the practical aspects of using Kubernetes at an intermediate level. Readers will learn about essential best practices for managing applications in a containerized environment, optimizing resource usage and ensuring high availability without getting bogged down by overly technical jargon or advanced deployment scenarios.",Intermediate,15,"[""deployment"", ""kubernetes"", ""ml"", ""architecture""]",blog,https://example.com/tutorials/kubernetes/96
97,High Availability Docker Swarm with Ansible Playbooks - Advanced Guide,"Dive deep into setting up a resilient, self-healing high availability (HA) environment using Docker and Ansible. This advanced guide covers orchestrating container deployments across multiple hosts while ensuring minimal downtime during updates or failures.",Advanced,120,"[""kubernetes"", ""architecture"", ""deployment""]",article,https://example.com/tutorials/docker/97
98,Advanced Machine Learning Techniques for Real-World Applications,"This article delves into sophisticated machine learning algorithms and their practical implementations, addressing challenges like data preprocessing, model selection, tuning hyperparameters, deploying models in production environments, and interpreting results. Targeted at professionals with a solid foundation in ML basics looking to advance their skills.",Advanced,60,"[""kubernetes"", ""docker"", ""python"", ""ml""]",article,https://example.com/tutorials/machine-learning/98
99,Docker for Beginners: An Introduction to Containerization Technologies,"Embark on your journey into the world of Docker, a powerful tool that encapsulte applications in containers. This beginner-level article demystifies container technology and shows you how it can streamline application development processes.",Beginner,30,"[""python"", ""kubernetes""]",article,https://example.com/tutorials/docker/99
100,Intro to Machine Learning for Beginners – Understanding the Basics,"Join us as we embark on a journey into machine learning, breaking down complex algorithms and concepts into simple terms. This blog post is designed with beginners in mind, aiming to build your foundational knowledge through clear explanations and easy-to-understand examples.",Beginner,60,"[""ml"", ""deployment""]",blog,https://example.com/tutorials/machine-learning/100
101,Docker for Beginners - An Introduction to Containerization,"Embark on a journey into the world of Docker, where this blog post demystifies container technology. Designed for beginners, it starts with what containers are and why they matter in modern software development.",Beginner,45,"[""docker"", ""kubernetes""]",blog,https://example.com/tutorials/docker/101
102,Kubernetes for Beginners: An Introduction to Container Orchestration Platforms,"Dive into the world of Kubernetes, a powerful system designed to automate deployment, scaling, and management of containerized applications. This beginner's guide will demystify core concepts such as Pods, Deployments, Services, and Ingress without requiring prior experience with containers or orchestration tools.",Beginner,60,"[""kubernetes"", ""deployment"", ""docker""]",article,https://example.com/tutorials/kubernetes/102
103,Advanced Deployment Techniques for Machine Learning Pipelines,"This blog post explores the intricacurate methods and practices required to deploy machine learning models into a production environment. Targeted at professionals with experience in machine learning, it delves into containerization technologies like Docker, orchestration tools such as Kubernetes, CI/CD pipelines integration, model monitoring strategies, performance tuning, scalability considerations for high-demand applications and compliance adherence.",Advanced,30,"[""kubernetes"", ""python"", ""architecture""]",blog,https://example.com/tutorials/machine-learning/103
104,Mastering Feature Engineering for Machine Learning Optimization at an Advanced Level,"This article delves into the intricacial aspects of feature engineering, a key component in developing high-performing machine learning models. Readers will explore advanced techniques such as automated feature selection, interaction detection, and domain knowledge integration for enhancing model accuracy and efficiency.",Advanced,60,"[""ml"", ""architecture"", ""python""]",article,https://example.com/tutorials/machine-learning/104
105,Docker for Beginners - Introduction to Containerization Technology,"Embark on a journey into the world of Docker, starting from its basics and understanding how container technology is revolutionizing software development. This blog post will guide you through setting up your first Docker environment, creating simple containers, and managing images.",Beginner,45,"[""ai"", ""python"", ""architecture""]",blog,https://example.com/tutorials/docker/105
106,Dockerize Your Machine Learning Pipeline - An Intermediate Guide,"This intermediate-level blog post walks readers through the process of containerizing a machine learning pipeline using Docker. By encapsulating dependencies, it ensures reproducibty and simplifies deployment across different environments.",Intermediate,120,"[""architecture"", ""ai"", ""docker""]",blog,https://example.com/tutorials/docker/106
107,Optimizing Docker for Production Environments: Best Practices and Advanced Techniques,"This blog post delves into the complexities of preparing a Dockerized application for production, discussing advanced configurations such as persistent storage management, network optimization within container orchestration platforms like Kubernetes, security hardening strategies including minimal base images and least privilege principles, resource allocation fine-tuning to prevent 'Docker thrashing', and continuous integration/continuous deployment (CI/CD) pipelines for robust production deployments. It's tailored towards experienced users who are ready to scale their Docker expertise.",Advanced,30,"[""deployment"", ""python"", ""ai"", ""architecture""]",blog,https://example.com/tutorials/docker/107
108,Containerize Your Application with Docker Intermediate Guide,"In this intermediate-level blog post, we'll delve into the practical steps of using Docker to containerize an application. We will explore how to create a Dockerfile, build images, and deploy containers for efficient development and deployment workflows.",Intermediate,45,"[""ai"", ""kubernetes""]",blog,https://example.com/tutorials/docker/108
