id,title,description,difficulty,duration_minutes,tags,format,url
1,Mastering Docker Swarm for High Availability Environments,"This advanced-level blog post delves into the complexities of deploying and scaling applications using Docker Swarm, with a focus on strategies to achieve high availability in production environments. It covers orchestration techniques that go beyond basic container management.",Advanced,15,"[""architecture"", ""ml"", ""deployment""]",blog,https://example.com/tutorials/docker/1
2,Kubernetes for Beginners - Introduction to Container Orchestration,"Join us as we dive into the world of Kubernetes, a powerful platform designed to automate deployment, scaling, and operations of application containers. In this beginner-friendly video tutorial, you'll learn the basics of container technology and how it simplifies your development workflow.",Beginner,60,"[""ml"", ""kubernetes"", ""deployment"", ""ai""]",video,https://example.com/tutorials/kubernetes/2
3,Intermediate Machine Learning Workshop - Building Predictive Models with Python and Scikit-Learn,"This interactive workshop will dive into practical aspects of machine learning, guiding participants through the process of developing predictive models using real data. The course covers various algorithms like regression, classification, clustering, and deep neural networks within scikit-learn library in Python.",Intermediate,90,"[""python"", ""kubernetes"", ""deployment"", ""ml""]",video,https://example.com/tutorials/machine-learning/3
4,Mastering Kubernetes Network Layer Security for Advanced Deployments,"This advanced-level article delves into the complexities of securing a Kubernetes network layer. It begins by establishing an understanding of how pods communicate within clusters, transitions to identifying potential threats in cloud environments and concludes with practical tactics for implementing robust security measures without compromising on performance.",Advanced,90,"[""kubernetes"", ""python""]",article,https://example.com/tutorials/kubernetes/4
5,Intermediate Docker Workflow with Continuous Integration - Streamed Video Course,"This video course guides you through setting up a continuous integration pipeline using Docker, providing hands-on experience on building and deploying applications. Targeted at intermediate users familiar with basic concepts of containerization.",Intermediate,15,"[""ai"", ""deployment"", ""architecture""]",video,https://example.com/tutorials/docker/5
6,Intermediate Kubernetes Masterclass: Orchestrating Container Workloads Effectively,"In this intermediate-level video, discover the intricain nuances of managing containerized applications with Kubernetes. Learn essential skills for creating scalable and resilient deployments that meet real production demands.",Intermediate,90,"[""deployment"", ""ai""]",video,https://example.com/tutorials/kubernetes/6
7,Docker for Beginners: An Introduction to Containerization Technology,"This beginner-friendly blog post will introduce you to Docker, a platform that simplifies the process of creating and running applications using containers. We'll start with understanding what containerization is and how Docker can improve your application development workflow.",Beginner,15,"[""kubernetes"", ""architecture""]",blog,https://example.com/tutorials/docker/7
8,Scalable Kubernetes Pod Deployments for Intermediate Developers,"Dive into the world of pods within a Kubernetes cluster, learning how to scale applications efficiently. This blog post provides practical guidance on deploying and managing pods with real-world examples.",Intermediate,15,"[""architecture"", ""ai"", ""python"", ""deployment""]",blog,https://example.com/tutorials/kubernetes/8
9,Docker Basics for Beginners - A Journey into Containerization,"This video tutorial introduces the fundamentals of Docker, guiding beginners through setting up a Docker environment and creating their first container. Learn how to package an application with all its dependencies inside containers, enscurbing development issues across different systems.",Beginner,90,"[""kubernetes"", ""ml"", ""docker"", ""python""]",video,https://example.com/tutorials/docker/9
10,Understanding the Basics of Machine Learning for Beginners,"Embark on a journey to learn about machine learning, starting with its fundamental concepts and simple algorithms. This beginner-friendly article demystifies complex ideas using clear examples and intuitive explanations.",Beginner,120,"[""docker"", ""python""]",article,https://example.com/tutorials/machine-learning/10
11,Advanced Docker Container Optimization for Production Environments,"In this advanced-level video, you'll learn how to optimize your Docker containers for maximum efficiency and scalability in production. We cover topics such as setting up multi-stage builds, managing container networking complexities, orchestrating with Kubernetes, handling persistent storage across instances, securing inter-container communication, and implementing CI/CD pipelines within the Docker ecosystem.",Advanced,90,"[""architecture"", ""ai"", ""python"", ""kubernetes""]",video,https://example.com/tutorials/docker/11
12,Beginner's Guide to Machine Learning Fundamentals for Python Developers,"This video tutorial is perfect for beginners interested in machine learning who have a basic understanding of programming, particularly with Python. It introduces the essential concepts and terminology needed before diving into more complex models.",Beginner,60,"[""python"", ""architecture"", ""ml""]",video,https://example.com/tutorials/machine-learning/12
13,Machine Learning for Beginners - An Introduction to the Basics of Machine Learning,"This beginner-level video guide simplifies key concepts and tools used in machine learning. Designed as a foundational educational tool, it demystifies algorithms like linear regression, decision trees, and neural networks with easy-to-understand analogies.",Beginner,30,"[""kubernetes"", ""python""]",video,https://example.com/tutorials/machine-learning/13
14,Securing Kubernetes Clusters for Production Environments - An Intermediate Guide,"In this article, we will explore the essential security practices needed to protect your production-grade Kubernetes clusters. We'll delve into Role-Based Access Control (RBAC), network policies, and secrets management while providing actionable steps for implementing these strategies effectively.",Intermediate,90,"[""ml"", ""python"", ""architecture""]",article,https://example.com/tutorials/kubernetes/14
15,Interpreting Feature Importance in Machine Learning Models for Intermediate Learners,"This blog post demystifies the concept of feature importance and provides practical insights on how it affects model performance. Through case studies, intermediate learners will understand when and why to use techniques like permutation importance or SHAP values in machine learning projects.",Intermediate,120,"[""architecture"", ""python"", ""ai""]",blog,https://example.com/tutorials/machine-learning/15
16,Introduction to Docker for Beginners,"Dive into the world of containerization with our beginner-friendly guide on Docker. Learn how containers work, their benefits over traditional virtual machines, and simple steps to set up your first Docker project.",Beginner,45,"[""docker"", ""deployment""]",blog,https://example.com/tutorials/docker/16
17,Kubernetes for Intermediate Developers: Deploying Applications Securely and Efficiently,"Dive into the world of Kubernetes with a focus on securing your applications. This intermediate-level article will guide you through best practices in setting up secure deployments, managing access controls effectively, and optimizing performance within this powerful container orchestration system.",Intermediate,30,"[""deployment"", ""python""]",article,https://example.com/tutorials/kubernetes/17
18,Intermediate Docker Workflows for Developers,"This article takes you through setting up a Continuous Integration/Continuous Deployment (CI/CD) pipeline using Docker. You will learn about creating containers, managing images and tags, pushing to registries, and automating deployments with Jenkins or GitLab CI.",Intermediate,120,"[""docker"", ""ai"", ""architecture"", ""python""]",article,https://example.com/tutorials/docker/18
19,Docker for Beginners: Setting Up Your First Container Environment,"This blog post is designed to introduce beginners to Docker, covering the basics of what containers are and how they can simplify application deployment. Learn step-bythought through hands-on instructions on setting up a simple container environment.",Beginner,30,"[""architecture"", ""kubernetes""]",blog,https://example.com/tutorials/docker/19
20,Intermediate Machine Learning Practices for Real-World Applications,"This video tutorial is designed to equip you with the practical skills required to implement machine learning algorithms in real-world scenarios. You'll learn about data preprocessing, model selection, and evaluation techniques at an intermediate level.",Intermediate,60,"[""ai"", ""docker"", ""python""]",video,https://example.com/tutorials/machine-learning/20
21,Intermediate Machine Learning with Python: Practical Approaches to Real World Problems,"This blog post delves into the intermediate-level techniques of machine learning using Python, focusing on practical applications that solve real world problems. The article guides readers through setting up data pipelines and applying common ML algorithms like SVM and Random Forests for classification tasks.",Intermediate,30,"[""python"", ""architecture"", ""ai"", ""docker""]",blog,https://example.com/tutorials/machine-learning/21
22,Docker for Intermediate DevOps Engineers - Streamlining Your Container Deployment Process,"This intermediate-level blog post delves into the essential Docker concepts and commands that will empower you as a devops engineer. Learn to set up, manage, and orchestrate containers effectively while understanding best practices for security and scalability in production environments.",Intermediate,90,"[""kubernetes"", ""ml"", ""python"", ""deployment""]",blog,https://example.com/tutorials/docker/22
23,Understanding Machine Learning for Beginners: An Introduction to Basics and Applications,"Dive into the world of machine learning with our beginner-friendly blog post designed to demystify this transformative technology. We'll cover fundamental concepts, practical applications, and real-world examples that will empower you as a novice in understanding how machines learn from data.",Beginner,15,"[""ml"", ""ai"", ""docker"", ""python""]",blog,https://example.com/tutorials/machine-learning/23
24,Mastering Docker Swarm Orchestration for High Availability Production Environments,"This advanced video tutorial delves into the complexities of deploying and managing applications using Docker in a production environment. The session is designed to equip IT professionals with deep technical knowledge on orchestrating containers, securing clusters, scaling services dynamically across multiple nodes for high availability.",Advanced,15,"[""architecture"", ""python""]",video,https://example.com/tutorials/docker/24
25,Docker for Beginners: A Simple Introduction to Containerization Technology,"This blog post demystifies Docker and provides a foundational understanding of container technology. Learn about creating, managing, and running applications inside containers with easy-to-understand examples.",Beginner,60,"[""python"", ""kubernetes"", ""deployment"", ""docker""]",blog,https://example.com/tutorials/docker/25
26,Intermediate Machine Learning Workshop - Practical Applications & Algorithms,"In this intermediate-level video, you'll explore practical applications of machine learning with hands-on projects. Dive into various algorithms and understand their use cases in data science to solve real-world problems.",Intermediate,15,"[""docker"", ""architecture""]",video,https://example.com/tutorials/machine-learning/26
27,Docker Basics for Beginners: A Foundation Course,"Welcome to 'Docker Basics for Beginners', a course designed to introduce the fundamental concepts and tools of Docker in an easy-to-understand manner. Whether you're new to containers or just getting started, this article will walk through setting up your first containerized application step by step.",Beginner,45,"[""kubernetes"", ""ml"", ""docker""]",article,https://example.com/tutorials/docker/27
28,Intermediate Guide to Kubernetes Security Practices,"This article dives into the practical measures needed for securing a Kubernetes cluster. It begins with understanding RBAC and its importance, followed by setting up network policies effectively in Pods to prevent unauthorized access. The guide also covers how to manage secrets securely using Role-based Access Control (RBAC) roles.",Intermediate,30,"[""docker"", ""deployment"", ""kubernetes"", ""architecture""]",article,https://example.com/tutorials/kubernetes/28
29,Kubernetes Fundamentals for Intermediate Users,"This video course is designed to enhance intermediate learners' understanding of Kubernetes, including practical skills in deploying and managing containerized applications. Participants will get hands-on experience with concepts like pods, services, ingress, configmaps, persistentvolumes, as well as setting up a cluster environment using Minikube or Kubespawning.",Intermediate,60,"[""kubernetes"", ""docker"", ""ai"", ""architecture""]",video,https://example.com/tutorials/kubernetes/29
30,Beginner's Guide to Understanding Machine Learning Fundamentals,"Welcome to the exciting world of machine learning! This beginner-level article is designed to introduce you to core concepts such as algorithms, data sets, and how models learn. With engaging visual aids and easy examples, this piece will lay down essential knowledge that serves as building blocks for further exploration.",Beginner,45,"[""kubernetes"", ""docker"", ""architecture"", ""ml""]",article,https://example.com/tutorials/machine-learning/30
31,Docker Essentials - Intermediate Guide to Containerization,"In 'Docker Essentials – Intermediate Guide to Containerization', learn about Docker's capabilities, best practices for deploying applications using containers. The video targets intermediate users seeking a practical approach without diving into the deep technical details of kernel-level virtualization.",Intermediate,120,"[""deployment"", ""kubernetes"", ""ml""]",video,https://example.com/tutorials/docker/31
32,Navigating StatefulSet Management on Kubernetes for Intermediate Developers,"This blog post delves into the intricain aspects of managing StatefulSets in a production-grade Kubernetes environment. It covers essential concepts and best practices, providing developers with practical knowledge to effectively deploy stateful applications.",Intermediate,90,"[""python"", ""kubernetes"", ""architecture"", ""ai""]",blog,https://example.com/tutorials/kubernetes/32
33,Mastering Kubernetes for Enterprise Production Environments - An Advanced Guide,"This advanced-level video course navigates through the complexities of managing a production environment with Kubernetes. Learn to architect resilient systems, perform maintenance tasks and troubleshoot issues effectively while mastering best practices adopted by industry leaders.",Advanced,120,"[""python"", ""docker"", ""kubernetes""]",video,https://example.com/tutorials/kubernetes/33
34,Intermediate Machine Learning Techniques for Predictive Analytics,"This video tutorial delves into intermediate-level machine learning techniques specifically designed to enhance predictive analytics. It covers essential algorithms, real-world applications, and hands-on coding exerthy in Python with scikit-learn.",Intermediate,90,"[""docker"", ""kubernetes"", ""ai"", ""python""]",video,https://example.com/tutorials/machine-learning/34
35,A Beginner's Guide to Machine Learning Concepts and Applications,"This article serves as an entry point into the exciting world of machine learning for beginners. Covering foundational concepts such as algorithms, data sets, supervised vs unsupervised learning, we aim to provide a clear understanding while introducing practical applications that demonstrate how these technologies impact our daily lives.",Beginner,90,"[""architecture"", ""ai""]",article,https://example.com/tutorials/machine-learning/35
36,Intermediate Docker Workflows with Practical Examples,"This video guide delves into the essentials of setting up and managing containers using Docker, providing intermediate learners with step-bythought practical examples to navigate through common workflow scenarios. It covers topics like building images from a Dockerfile, multi-container setups via docker-compose, networking between services, volume management for persistent storage, as well as orchestration techniques.",Intermediate,45,"[""deployment"", ""docker""]",video,https://example.com/tutorials/docker/36
37,Introduction to Docker for Beginners,Dive into the world of containers with our beginner-friendly guide on using Docker. Learn how this powerful tool can streamline your development process and deploy applications efficiently across various environments.,Beginner,60,"[""ai"", ""deployment"", ""ml"", ""python""]",article,https://example.com/tutorials/docker/37
38,Mastering Production-Level Machine Learning with PyTorch & TensorFlow,"This advanced video course will delve into the intricainces of machine learning using cutting-edge libraries like PyTorch and TensorFlow. Experts aimed at professionals already acquainted with basics, who are now seeking to implement ML solutions in production environments.",Advanced,15,"[""kubernetes"", ""ai""]",video,https://example.com/tutorials/machine-learning/38
39,Docker Essentials for Developers - Intermediate Guide with Practical Examples,"This intermediate-level video tutorial offers a deep dive into Docker, its benefits, and hands-on experience using real-world scenarios. Learn to containerize applications effectively while understanding the security implications of your deployments.",Intermediate,15,"[""kubernetes"", ""ml"", ""ai""]",video,https://example.com/tutorials/docker/39
40,Machine Learning Fundamentals for Beginners - An Introduction to Algorithms and Data Science Techniques,"Dive into the world of machine learning with this beginner-friendly blog post that demystifies key concepts, explores foundational algorithms such as linear regression and decision trees, and introduces basic data preprocessing techniques. Ideal for those starting their journey in AI.",Beginner,90,"[""kubernetes"", ""python"", ""ml"", ""deployment""]",blog,https://example.com/tutorials/machine-learning/40
41,Docker Masterclass - Containerization for Professionals (Intermediate),"Join us as we delve into the world of Docker, learning how to efficiently create and manage containers in this intermediate-level video tutorial. We'll cover best practices, common pitfalls, security implications, and real-world deployment strategies.",Intermediate,45,"[""python"", ""docker"", ""ml"", ""kubernetes""]",video,https://example.com/tutorials/docker/41
42,Beginner's Guide to Kubernetes for DevOps Essentials,"This video tutorial introduces the fundamentals of Kubernetes, a powerful tool that orchestrates containerized applications across clusters. Aimed at beginners in cloud computing and software deployment practices, it simplifies core concepts such as pods, services, deployments, and namespaces to ensure an easy understanding.",Beginner,120,"[""deployment"", ""kubernetes""]",video,https://example.com/tutorials/kubernetes/42
43,Kubernetes for Beginners - A Foundational Guide to Container Orchestration,"This beginner-friendly video tutorial will introduce you to the basics of Kubernetes, including setting up your first cluster and deploying a simple application. Designed for newcomers with no prior knowledge, this resource simplifies complex concepts into easy-to-understand terms.",Beginner,90,"[""ml"", ""kubernetes""]",video,https://example.com/tutorials/kubernetes/43
44,Mastering Kubernetes Architecture for Enterprise Production Environments - An Advanced Guide,"Dive into the complexities of deploying and managing applications in production-grade environments using advanced Kubernetes concepts. This guide caters to DevOps professionals with an understanding of containerization, seeking insights on orchestration intricain particulars.",Advanced,60,"[""docker"", ""deployment"", ""ml"", ""architecture""]",blog,https://example.com/tutorials/kubernetes/44
45,Mastering Production-Level Machine Learning with Python Pipelines and Hyperparameter Tuning,"This advanced tutorial is designed for experienced data scientists or ML engineers looking to deepen their skills. Dive into the intricain details of creating efficient, robust machine learning pipelines using Python libraries like scikit-learn, TensorFlow, and PyTorch, along with techniques such as grid search and Bayesian optimization for hyperparameter tuning.",Advanced,120,"[""kubernetes"", ""python""]",video,https://example.com/tutorials/machine-learning/45
46,Docker for Beginners: An Introduction to Containerization,"This article is designed to introduce beginners to Docker, an open-source platform that simplifies the process of creating and managing applications by encapsulating them in containers. You will learn what containerization means, why it's important for modern software development, and how you can start using Docker on your own machine.",Beginner,45,"[""ai"", ""python"", ""ml""]",article,https://example.com/tutorials/docker/46
47,Kubernetes for Beginners: Getting Started with Container Orchestration,"This beginner-friendly blog post introduces the concept of Kubernetes, a powerful tool used to manage and orchestrate containerized applications. Learn about setting up your first Kubernetes cluster, deploying containers, and handling basic configurations for an efficient start into cloud computing.",Beginner,120,"[""deployment"", ""kubernetes"", ""python""]",blog,https://example.com/tutorials/kubernetes/47
48,Advanced Kubernetes Optimization Techniques for Production Systems,"This article dives into the intricate details of optimizing a Kubernetes-based production environment, from setting up resource quotas to implementing advanced scheduling algorithms and security best practices. It's designed as an invaluable guide for system administrators who need to streamline operations at scale.",Advanced,45,"[""ai"", ""ml"", ""kubernetes"", ""python""]",blog,https://example.com/tutorials/kubernetes/48
49,Mastering Docker Swarm Management for Deployment at Scale,"This blog post delves into the complexities of managing and orchestrating services within a Docker Swarm, providing best practices to deploy applications reliably across multiple hosts. It is tailored towards intermediate users with prior basic knowledge in containerization who aim to optimize their systems for large-scale production environments.",Intermediate,30,"[""deployment"", ""docker"", ""ai"", ""architecture""]",blog,https://example.com/tutorials/docker/49
50,Beginner's Guide to Kubernetes for Enterprise Environments,"This video-based course demystifies the basics of deploying and managing containerized applications on Kubernetes, tailored specifically for enterprise users. It starts with a fundamental understanding of containers before diving into how they are orchestrated using Kubernetes in real-table scenarios.",Beginner,120,"[""python"", ""ai""]",video,https://example.com/tutorials/kubernetes/50
51,Intermediate Machine Learning Techniques for Predictive Analytics,"In this intermediate-level video, learners are guided through a range of machine learning techniques specifically tailored to enhance predictive analytics capabilities. From regression analysis and classification tasks to more complex ensemble methods like random forest and gradient boosting machines (GBM), participants will gain hands-on experience in applying these tools.",Intermediate,15,"[""kubernetes"", ""docker"", ""ai""]",video,https://example.com/tutorials/machine-learning/51
52,Docker Basics for Beginners: Containerize Your Application Simply!,"In this beginner-level video, discover the fundamentals of Docker as you learn how to containerize applications with ease. Follow along in simple steps that demystify containers and open your eyes to a powerful tool for modern software development.",Beginner,30,"[""python"", ""deployment""]",video,https://example.com/tutorials/docker/52
53,Docker for Beginners - Your First Container Journey!,"Embark on the transformative world of Docker with a beginner's guide designed to demystify containerization. Learn the basics, understand how containers work, and start your own projects step-by-step.",Beginner,120,"[""kubernetes"", ""docker"", ""ai""]",blog,https://example.com/tutorials/docker/53
54,Machine Learning Basics for Beginners,"This article provides a beginner-friendly introduction to machine learning. We cover the foundational concepts such as algorithms, data types used in ML, and common challenges beginners face when diving into this exciting field.",Beginner,120,"[""ai"", ""architecture"", ""deployment"", ""python""]",article,https://example.com/tutorials/machine-learning/54
55,Intermediate Kubernetes Masterclass - Building Scalable Applications with Pods and Services,"This intermediate-level video tutorial dives into the practical aspects of deploying scalable applications using pods, services, ingress controllers in Kubernetes. You'll learn how to manage complex application structures while enscuring optimal resource utilization.",Intermediate,45,"[""architecture"", ""python"", ""deployment"", ""docker""]",video,https://example.com/tutorials/kubernetes/55
