id,title,description,difficulty,duration_minutes,tags,format,url
159,The Beginner's Guide to Machine Learning Essentials,"This beginner-level article will introduce you to the foundational concepts of machine learning, including data types and model selection. By understanding these basics, learners can start building their knowledge base for more advanced studies.",Beginner,90,"[""python"", ""ai"", ""docker""]",article,https://example.com/tutorials/machine-learning/159
160,Beginner's Guide to Kubernetes - Setting Up Your First Pod,"This video tutorial introduces beginners to the concept of containers, and how they are orchestrated in Kubernetes. Watch as we set up a simple pod from scratch, learn about its components like container specs and resource requests/limits, and get hands-on experience deploying your first application with Kubernetes.",Beginner,90,"[""deployment"", ""ai"", ""ml""]",video,https://example.com/tutorials/kubernetes/160
161,Kubernetes Deep Dive: Container Orchestration Made Simple,"This intermediate-level video guide simplifies the complexities of Kubernetes container orchestration. Discover how to manage and scale applications across clusters, understand best practices for deployment strategies like Rolling Updates or Canary Releases, explore advanced networking concepts within Kubernetes such as Services and Ingress, and learn about monitoring your deployments with Prometheus.",Intermediate,45,"[""deployment"", ""architecture""]",video,https://example.com/tutorials/kubernetes/161
162,Machine Learning for Beginners: An Introduction to Simple Algorithms and Applications,"Welcome to the basics of machine learning (ML)! In this blog post, we'll explore fundamental ML concepts such as algorithms like linear regression, decision trees, neural networks, and their real-world applications. You will learn how these foundational tools can be used in various industries including healthcare, finance, and e-commerce to drive insights from data.",Beginner,60,"[""deployment"", ""docker""]",blog,https://example.com/tutorials/machine-learning/162
163,Mastering Docker for Production Environments - Advanced Techniques and Optimization Strategies,"This advanced-level video tutorial guides you through the intricate aspects of deploying applications using Docker in production settings. You will learn about securing containers, scaling with swarm mode, orchestrating services efficiently, fine-tuning resource allocation for optimal performance, and more.",Advanced,90,"[""architecture"", ""ml""]",video,https://example.com/tutorials/docker/163
164,Introduction to Machine Learning for Beginners: An Easy Guide,"This article serves as a comprehensive yet simple guide for beginners interested in understanding the basics of machine learning. It covers fundamental concepts, terminology, and real-world applications that will help newcomers grasp how machines learn from data.",Beginner,120,"[""ai"", ""kubernetes"", ""deployment""]",article,https://example.com/tutorials/machine-learning/164
165,Interpreting Model Performance Metrics for Intermediate Machine Learning Projects,"In this intermediate-level blog, we delve into the practical aspects of evaluating machine learning models. We explore various performance metrics beyond accuracy and discuss how they can inform model selection in real-world applications.",Intermediate,45,"[""ml"", ""deployment"", ""docker"", ""architecture""]",blog,https://example.com/tutorials/machine-learning/165
166,Advanced Neural Network Architectures for High-Level Image Recognition using TensorFlow and Keras,"This article delves into the creation, optimization, and implementation of state-ofinferring advanced neural network architectures tailored specifically for high-level image recognition tasks. Through hands-on examples utilizing industry-leading libraries like TensorFlow and Keras, readers will gain insights into cutting-edge techniques such as transfer learning, attention mechanisms, and custom layers while also addressing common challenges faced at the production level.",Advanced,60,"[""kubernetes"", ""python"", ""docker"", ""ml""]",article,https://example.com/tutorials/machine-learning/166
167,Kubernetes Essentials for Intermediate Developers,"This blog post demystifies Kubernetes, offering a hands-on guide to understanding and deploying applications. It covers creating your first deployment while also discussing scaling strategies and troubleshooting common issues.",Intermediate,15,"[""deployment"", ""ml"", ""docker"", ""architecture""]",blog,https://example.com/tutorials/kubernetes/167
168,Mastering Docker Swarm for Production Environment Deployment,"This advanced article dives deep into setting up, configuring, and managing a production-ready deployment using Docker Swarm orchestration. Learn to tackle challenges in scalability, fault tolerance, service discovery, networking complexities, load balancing and rolling updates for containerized applications.",Advanced,30,"[""deployment"", ""kubernetes""]",article,https://example.com/tutorials/docker/168
169,Docker Basics for Beginners - An Introduction to Containerization,"Join us as we demystify Docker, the revolutionary platform that allows you to package and run your applications in containers. This beginner-friendly blog post will guide you through setting up a simple Docker environment on Ubuntu 20.04 LTS.",Beginner,30,"[""ai"", ""docker"", ""ml"", ""deployment""]",blog,https://example.com/tutorials/docker/169
170,Machine Learning Basics for Beginners - A Simple Introduction to Algorithms and Models,"Dive into the fascinthinking world of machine learning with our beginner-friendly video. We explore foundational concepts such as algorithms, data sets, supervised vs unsupervised learning, neural networks basics, and their real-world applications in this easy-to-understand tutorial.",Beginner,60,"[""architecture"", ""deployment""]",video,https://example.com/tutorials/machine-learning/170
171,Docker for Beginners: An Introduction to Containerization,"This article is designed to introduce beginner-level readers to Docker, the popular platform that simplifies application deployment. We'll start by understanding what containers are and why they’re essential in modern software development before diving into creating your first Docker image.",Beginner,45,"[""docker"", ""python""]",article,https://example.com/tutorials/docker/171
172,Intro to Machine Learning for Beginners,"Join us as we embark on a journey through the basics of machine learning. In this beginner-friendly blog series, you'll learn about simple concepts like supervised and unsupervised algorithms without any prior knowledge in the field.",Beginner,15,"[""deployment"", ""docker"", ""ml""]",blog,https://example.com/tutorials/machine-learning/172
173,Docker for Beginners: A Simple Introduction to Containerization Technology,"This beginner-level video tutorial provides a foundational understanding of Docker, the revolutionary tool that simplifies application deployment. Learn what containers are and how they transform software development and operations into an easy process.",Beginner,120,"[""ml"", ""deployment"", ""python""]",video,https://example.com/tutorials/docker/173
174,Advanced Kubernetes Production Setup Masterclass,"This advanced tutorial video course delves deep into production-level Kubernetes configurations, strategies for handling complex deployments and scaling issues. Learn how to optimize your clusters with cutting-edge practices.",Advanced,90,"[""ml"", ""deployment"", ""kubernetes""]",video,https://example.com/tutorials/kubernetes/174
175,Mastering Docker Swarm for High Availability Production Environments,"This advanced article delves into the intricain specifics of deploying and managing container orchestration with Docker Swarm. It discusses strategies to handle complex deployment scenarios, scaling across multiple nodes, ensuring failover mechanisms, networking inside a swarm for high availability, as well as security best practices in production environments.",Advanced,90,"[""architecture"", ""ai"", ""docker""]",article,https://example.com/tutorials/docker/175
176,Optimizing Docker Performance for High Availability Environments,"In this advanced blog post, we delve into the complexities of managing and optimizing a high-availability environment using containers with Docker. We explore strategies such as orchestration tools like Kubernetes, service mesh implementations, network policies for microservices, storage solutions, and best practices to ensure that your containerized applications remain responsive under varying loads.",Advanced,30,"[""architecture"", ""ml"", ""python"", ""deployment""]",blog,https://example.com/tutorials/docker/176
177,Advanced Techniques in Production-Level Machine Learning Pipelines with Python and TensorFlow,"This article delves into the intricain aspects of constructing sophisticated machine learning pipelines tailored for production environments. It discusses strategies to handle large datasets, model serialization/deserialization using TensorFlow's SavedModel format, and continuous monitoring with Prometheus in a Python ecosystem.",Advanced,120,"[""ml"", ""deployment"", ""kubernetes""]",article,https://example.com/tutorials/machine-learning/177
178,Intermediate Machine Learning Workshop - Practical Application with Python,"Dive into the world of machine learning through this intermediate-level workshop, where you'll learn practical skills by coding. Participants will gain hands-on experience using popular libraries like scikit-learn and TensorFlow to solve real-world problems.",Intermediate,90,"[""python"", ""ai""]",video,https://example.com/tutorials/machine-learning/178
179,Docker for Beginners: An Introduction to Containerization Technology,"Embark on your Docker journey with this article tailored for beginners, explaining the fundamental concepts behind container technology and its real-world applications. You will learn how containers encapsulate an application'thinking of 'images', but first understand what they are.",Beginner,60,"[""docker"", ""python"", ""kubernetes"", ""ml""]",article,https://example.com/tutorials/docker/179
180,Kubernetes Architectures for High Availability Environments,"This advanced video tutorial dives into the intricaincs of designing Kubernetes clusters to ensure high availability. It covers topics such as multi-zone setups, disaster recovery strategies, and balancing load among cluster nodes.",Advanced,30,"[""ai"", ""deployment"", ""architecture"", ""python""]",video,https://example.com/tutorials/kubernetes/180
181,Kubernetes for Beginners: An Introduction to Container Orchestration,"This beginner-level article offers a fundamental understanding of Kubernetes, introducing core concepts such as pods, containers, and clusters. It is designed to equip newcomers with the basic knowledge required to understand how container orchestration works in practice.",Beginner,120,"[""kubernetes"", ""ai""]",article,https://example.com/tutorials/kubernetes/181
182,Advanced Techniques in Production-Level Machine Learning - Unlocking Efficiency and Accuracy for Large Datasets,"Dive deep into the world of advanced production-level machine learning with our video course. Learn cutting-edge methods to handle large datasets, optimize models on hardware accelerators like GPUs or TPUs, fine-increase accuracy and efficiency in real-world applications. This course is designed for experienced developers looking to master complex algorithms at a granular level.",Advanced,120,"[""architecture"", ""kubernetes"", ""ml"", ""python""]",video,https://example.com/tutorials/machine-learning/182
183,Beginner's Guide to Kubernetes for DevOps Fundamentals,"This beginner-level educational video unlocks the core concepts of Kubernetes, providing learners with a fundamental understanding suitable for those starting in devops. Through practical examples and easy explanations, viewers will get acquainted with terminologies like pods, nodes, services, deployments, etcd, controllers, as well as how to set up their first deployment on Minikube or GKE.",Beginner,30,"[""ai"", ""architecture"", ""ml""]",video,https://example.com/tutorials/kubernetes/183
184,Kubernetes Simplified: A Beginner's Guide to Container Orchestration,"Dive into the world of Kubernetes with this beginner-friendly blog post, designed to demystify container orchestration and provide you with a solid foundation. You’ll learn about deploying simple applications on K8S clusters while understanding basic concepts like pods, services, and volumes.",Beginner,15,"[""ai"", ""deployment""]",blog,https://example.com/tutorials/kubernetes/184
185,Docker for Beginners - Introduction to Containerization with Docker,"Embark on the journey of understanding container technology by mastering Docker in this foundational video course. Learn about containers, images, and how they revolutionize software deployment. Suitable for beginners looking to grasp basic concepts.",Beginner,90,"[""ai"", ""deployment"", ""kubernetes""]",video,https://example.com/tutorials/docker/185
186,Kubernetes Essentials for Intermediate Developers - An In-Depth Guide to Container Orchestration and Management,"This article provides an intermediate level understanding of Kubernetes, focusing on practical aspects like deploying applications, scaling pods based on demand, managing persistent storage, and handling service discovery. It is designed for developers who are comfortable with containerization but need to understand the operational intricaries of using Kubernetes effectively in a production environment.",Intermediate,45,"[""docker"", ""ai""]",article,https://example.com/tutorials/kubernetes/186
187,Docker Essentials for Intermediate Developers - Mastering Containization and Orchestration,"In this intermediate-level video course, learn how to harness the power of Docker as you containerize applications effectively. Gain insights into managing multi-container environments using Kubernetes with hands-on exercurse for orchestrating your services in production.",Intermediate,90,"[""kubernetes"", ""docker"", ""ml""]",video,https://example.com/tutorials/docker/187
188,Advanced Techniques for Scalable Machine Learning Pipelines with PySpark and YARN on AWS EMR,"This blog post delves into the technical aspects of creating production-ready machine learning pipelines using advanced Python technologies such as PySpark. It navigates through setting up a high-performance Hadoop ecosystem within AWS Elastic MapReduce (EMR) leveraging YARN, and optimizing data processing workflows for efficiency and scalability.",Advanced,60,"[""kubernetes"", ""docker""]",blog,https://example.com/tutorials/machine-learning/188
189,Docker for Beginners: Containerize Your Application Simply,"Welcome to Docker, where we simplify the art of packaging and deploying your application in containers. In this beginner-level blog post, you'll learn how Docker streamlines software delivery by isolating applications within a lightweight container that shares the host system’in kernel without requiring extra overhead.",Beginner,60,"[""ml"", ""ai"", ""docker"", ""kubernetes""]",blog,https://example.com/tutorials/docker/189
190,Mastering Kubernetes for Intermediate Deployments,"Dive into the intermediate aspects of managing applications with Kubernetes, including service discovery and load balancing. This article provides practical advice on designing scalable systems that can handle real-world production environments.",Intermediate,15,"[""deployment"", ""docker"", ""ai""]",article,https://example.com/tutorials/kubernetes/190
191,Machine Learning for Beginners - An Introductory Guide to AI's Building Blocks,"Dive into the foundational aspects of machine learning, an exciting and rapidly evolving field. This beginner-friendly article introduces basic concepts such as algorithms, data sets, supervised and unsupervised learning, alongside simple yet effective examples that illuminate how machines can learn from experience.",Beginner,90,"[""python"", ""docker"", ""ml"", ""architecture""]",article,https://example.com/tutorials/machine-learning/191
192,Mastering Production Level Machine Learning with TensorFlow: Advanced Techniques and Best Practices,"This advanced-level video tutorial takes a deep dive into the intricain aspects of machine learning production, focusing on using TensorFlow for high performance. The course explores model optimization strategies such as quantization and pruning, efficient data loading with tf.data API, custom training loops, distributed training techniques including multi-GPUs, and deploying models to the cloud or edge devices.",Advanced,45,"[""ai"", ""docker"", ""kubernetes"", ""python""]",video,https://example.com/tutorials/machine-learning/192
193,Mastering Kubernetes for Production Environments - Advanced Techniques and Best Practices,"Dive into the intricain details of setting up, managing, and troubleshooting a robust production-level deployment using advanced Kubernetes features. Learn about high availability strategies, performance tuning, security practices, and much more.",Advanced,90,"[""docker"", ""architecture"", ""kubernetes""]",video,https://example.com/tutorials/kubernetes/193
194,Intermediate Kubernetes Administration Workshop,"Join our comprehensive workshop designed to provide an in-depth understanding of managing and automating applications with Kubernetes. This intermediate level course will guide you through the setup, scaling, load balancing, networking policies, security practices as well as advanced troubleshooting techniques.",Intermediate,15,"[""ml"", ""python"", ""docker"", ""kubernetes""]",article,https://example.com/tutorials/kubernetes/194
195,Intermediate Machine Learning Techniques for Real World Applications,"This intermediate-level video course provides a comprehensive understanding of machine learning techniques and their practical applications. Designed to bridge the gap between theory and practice, learners will gain hands-on experience in building predictive models using Python libraries like scikit-learn.",Intermediate,45,"[""ml"", ""ai"", ""python""]",video,https://example.com/tutorials/machine-learning/195
196,Mastering Kubernetes for Real-World Scenarios: Advanced Topics and Best Practices,"Dive deep into the advanced aspects of using Kubernetes, from setting up highly available clusters to orchestrating complex multi-tier deployments. This blog post will guide you through best practices that ensure robustness and scalability in production environments.",Advanced,45,"[""ai"", ""ml"", ""python""]",blog,https://example.com/tutorials/kubernetes/196
197,Beginner's Guide to Understanding Kubernetes Architecture,"This blog post serves as an introductinary guide, breaking down the fundamental components and concepts of Kubernetes. Learn about pods, nodes, clusters, deployments, services, and ingress controllers in this easy-to-understand format that sets you on your path to mastering container orchestration.",Beginner,45,"[""python"", ""ai"", ""docker""]",blog,https://example.com/tutorials/kubernetes/197
198,Docker for Beginners - An Introduction to Containerization Technology,"This article introduces Docker, the popular container technology that simplifies and streamlines application deployment. We'll cover what containers are, why they matter in modern development environments, and provide a step-bython tutorial on setting up your first Docker environment.",Beginner,45,"[""docker"", ""ml"", ""python"", ""deployment""]",article,https://example.com/tutorials/docker/198
199,Mastering Kubernetes Production Environments - Advanced Deep Dive and Best Practices,"Dive deep into the inner workings of advanced production-level Kubernetes, exploring best practices for deploying resilient systems. This video course covers complex topics like multi-cluster management, high availability setups, node auto-scaling policies, and cost optimization strategies.",Advanced,60,"[""docker"", ""architecture"", ""ai"", ""python""]",video,https://example.com/tutorials/kubernetes/199
200,Kubernetes Essentials for Intermediate Developers - Streamlining Deployment and Scalability,"This video is crafted to provide intermediate-level developers with a deeper understanding of Kubernetes' deployment strategies, scaling mechanisms, and best practices. Participants will learn how to effectively manage containerized applications in production environments.",Intermediate,45,"[""python"", ""ml"", ""deployment"", ""kubernetes""]",video,https://example.com/tutorials/kubernetes/200
201,Docker for Beginners - Containerizing Your Applications,"This beginner-level video tutorial introduces Docker, a platform that simplifies the process of creating and running applications in containers. Learn how to package your code along with its dependencies into lightweight packages called 'containers' using this widely adopted tool for easy deployment.",Beginner,90,"[""deployment"", ""docker"", ""ai"", ""ml""]",video,https://example.com/tutorials/docker/201
202,Machine Learning for Beginners - A Practical Introduction to Making Simple Predictions with Python,"This beginner-friendly blog post demystifies machine learning by guiding you through setting up a basic predictive model using popular libraries like scikit-learn and pandas. We will walk step bythought process, including data collection, preprocessing, training models, making predictions, and evaluating accuracy with real Python code snippets.",Beginner,90,"[""docker"", ""kubernetes""]",blog,https://example.com/tutorials/machine-learning/202
203,Docker for Beginners - Your First Container Journey,"This beginner-friendly blog post introduces the fundamental concepts of Docker, guiding you through setting up your first container on Linux and Windows. It covers installation processes, basic commands like 'docker run', and initial troubleshooting tips for newcomers to Kubernetes.",Beginner,60,"[""architecture"", ""ml"", ""deployment"", ""python""]",blog,https://example.com/tutorials/docker/203
204,Navigating Intermediate Docker Concepts for Real-World Applications,"This blog post delves into the intermediate aspects of using Docker, providing actionable insights and best practices to effectively deploy applications. Readers will understand how to optimize container images, implement orchestration with Kubernetes, handle persistent storage in a dockerized environment, and ensure security measures are firmly integrated within their workflow.",Intermediate,120,"[""architecture"", ""kubernetes""]",blog,https://example.com/tutorials/docker/204
205,Mastering Kubernetes for High Availability Production Environments,"This article delves into advanced techniques of orchestrating containerized applications using Kubernetes, emphasizing strategies to ensure high availability and resilience in production environments. Through real-world examples and best practices, readers will gain insights on designing complex deployments with multiple tiers while managing stateful services effectively.",Advanced,45,"[""docker"", ""python"", ""deployment""]",article,https://example.com/tutorials/kubernetes/205
206,Kubernetes Essentials for Developers - Intermediate Guide to Managing Microservices,"This intermediate-level blog post provides developers with practical Kubernetes knowledge, focusing on microservice management and orchestration. It covers deploying applications using Helm charts, scaling services efficiently across clusters, monitoring resource usage effectively, and setting up self-healing mechanisms for greater resilience.",Intermediate,30,"[""docker"", ""python"", ""deployment""]",blog,https://example.com/tutorials/kubernetes/206
207,Advanced Deployment Strategies for Machine Learning Pipelines,"Dive deep into the complexities of deploying machine learning models at a production level. This blog post will guide you through understanding different deployment options, handling real-time data feeds with ML systems, and implementing robust monitoring strategies to ensure performance efficiency.",Advanced,60,"[""python"", ""docker"", ""kubernetes""]",blog,https://example.com/tutorials/machine-learning/207
208,Interpreting the Impact of Bias Mitigation Strategies on Machine Learning Models,"This intermediate-level blog post delves into practical techniques used to identify and reduce bias in machine learning models. By understanding common sources of bias, readers can apply strategic mitigations that enhance model fairness without compromising performance.",Intermediate,15,"[""ai"", ""architecture"", ""docker"", ""deployment""]",blog,https://example.com/tutorials/machine-learning/208
209,Understanding Pods in Kubernetes – An Intermediate Guide,"This article delves into the fundamental role of pods within a Kubernetes environment, exploring how they encapsulate containers that work together and detailing best practices for their deployment to create efficient microservices architectures.",Intermediate,90,"[""ml"", ""deployment"", ""architecture"", ""kubernetes""]",article,https://example.com/tutorials/kubernetes/209
210,Intermediate Machine Learning Techniques for Real-World Applications,"This intermediate level video tutorial delves into practical machine learning strategies. It covers various algorithms, their applications in industry scenarios and includes hands-on coding examples.",Intermediate,60,"[""kubernetes"", ""ml""]",video,https://example.com/tutorials/machine-learning/210
